{
  "schema_version": 1,
  "generated_at": "2026-01-01T00:00:26.000Z",
  "run": {
    "id": "id-00000000",
    "workspace_id": "id-00000000",
    "scenario": {
      "id": "notes-service-handoff-sh",
      "version": "1.0.0"
    },
    "state": "CLEANUP_VERIFIED",
    "outcome": "ABORTED",
    "provider": "lima",
    "isolation": "vm",
    "labels": [
      "egress: NOT ENFORCED (PARTIAL, best-effort): default routes were removed at provision time and verified, and workloads run as an unprivileged guest user without sudo that cannot re-add them (verified); this is not a firewall: host-gateway reachability and any guest privilege escalation are not covered",
      "automated rehearsal: harness-driven, not an independent human drill",
      "AC-08 human receipt: PENDING_HUMAN_RECEIPT"
    ],
    "created_at": "2026-01-01T00:00:04.000Z",
    "started_at": "2026-01-01T00:00:08.000Z",
    "finished_at": "2026-01-01T00:00:20.000Z",
    "imported": false,
    "fault_injected": false
  },
  "binding": {
    "artifact_digest": "5aca46616adc057b2bf52fae8777e6ff0540ac67f264872ee5f173655a07d11a",
    "runbook_hash": "a0334c4dd698616326bc00d2755331c712430bfcfb3d331c7c1da5cb70dba7bc",
    "scenario_version": "1.0.0",
    "manifest_digest": "d91150696ed7a3544bc4b360ae1a757ee5ec94f2a7b2d11498024addc5cfd6fe",
    "binding_digest": "f3c8830fc3f42aad068448f5bf2ef5f8e04409a7b6f822ce9ff9d545885255e7"
  },
  "operator": {
    "kind": "automated",
    "ref": "qa-harness",
    "builder_ref": "fixture-builder"
  },
  "verdict": {
    "verdict": "FAIL",
    "steps_and_cleanup_pass": false,
    "independent": false,
    "exit_code": 1,
    "reasons": [
      {
        "code": "RUN_ABORTED",
        "message": "the run was aborted before completion"
      }
    ],
    "human_receipt": "PENDING_HUMAN_RECEIPT",
    "binding_check": "NOT_CHECKED"
  },
  "claimed_verdict": null,
  "preflight": {
    "checked": {
      "artifact_entries": 13,
      "manifest": true,
      "runbook": true,
      "scripts": 9
    },
    "findings": [],
    "isolation": "vm",
    "provider": "lima",
    "schema_version": 1,
    "status": "PASS"
  },
  "steps": [
    {
      "step_key": "install",
      "action": "install",
      "mandatory": true,
      "status": "ERROR",
      "reason_code": "RUN_ABORTED",
      "deadline_seconds": 180,
      "started_at": "2026-01-01T00:00:11.000Z",
      "finished_at": "2026-01-01T00:00:17.000Z",
      "duration_ms": 6000,
      "evidence_hash": "3f2a237bee3ebd8961eef2d251749560c2d37db9fcade6016d0b54024695ccba",
      "checks": [
        {
          "actual": "install script was interrupted: the run was aborted",
          "name": "install script exit 0",
          "status": "FAIL"
        }
      ],
      "intervention_ids": []
    },
    {
      "step_key": "restore",
      "action": "restore",
      "mandatory": true,
      "status": "SKIPPED",
      "reason_code": "RUN_ABORTED",
      "deadline_seconds": 180,
      "started_at": null,
      "finished_at": null,
      "duration_ms": null,
      "evidence_hash": null,
      "checks": [],
      "intervention_ids": []
    },
    {
      "step_key": "rotate",
      "action": "rotate",
      "mandatory": true,
      "status": "SKIPPED",
      "reason_code": "RUN_ABORTED",
      "deadline_seconds": 180,
      "started_at": null,
      "finished_at": null,
      "duration_ms": null,
      "evidence_hash": null,
      "checks": [],
      "intervention_ids": []
    },
    {
      "step_key": "recover",
      "action": "recover",
      "mandatory": true,
      "status": "SKIPPED",
      "reason_code": "RUN_ABORTED",
      "deadline_seconds": 180,
      "started_at": null,
      "finished_at": null,
      "duration_ms": null,
      "evidence_hash": null,
      "checks": [],
      "intervention_ids": []
    }
  ],
  "interventions": [],
  "evidence": [
    {
      "id": "id-00000000",
      "kind": "manifest",
      "step_key": null,
      "sha256": "84bcef1315bd0dd5cc13a8a293feaffe515ce9a9c1e268375df7e40e40e43361",
      "media_type": "application/json",
      "size_bytes": 2194,
      "redacted": true
    },
    {
      "id": "id-00000000",
      "kind": "preflight_report",
      "step_key": null,
      "sha256": "f718ff2a2e34ffe42f1be39d66cf8727986394a9cc4c107a6ab3cda566b58f84",
      "media_type": "application/json",
      "size_bytes": 162,
      "redacted": true
    },
    {
      "id": "id-00000000",
      "kind": "run_receipt",
      "step_key": null,
      "sha256": "8c142f06f337aeb9c280bcf29e3e4733f1add99a7eb1b68a19e02c9db8dbc66e",
      "media_type": "application/json",
      "size_bytes": 616,
      "redacted": true
    },
    {
      "id": "id-00000000",
      "kind": "step_log",
      "step_key": "install",
      "sha256": "ea0f67a869b7d4644b7a765345e0713ccdfba697183bb3b0925a29a4e2563628",
      "media_type": "text/plain",
      "size_bytes": 24,
      "redacted": true
    },
    {
      "id": "id-00000000",
      "kind": "step_log",
      "step_key": "install",
      "sha256": "5ee38fba5dc2874224ca25de53bb33ebc2753601468d2fb930dbaa1294abbedb",
      "media_type": "text/plain",
      "size_bytes": 24,
      "redacted": true
    },
    {
      "id": "id-00000000",
      "kind": "step_receipt",
      "step_key": "install",
      "sha256": "3f2a237bee3ebd8961eef2d251749560c2d37db9fcade6016d0b54024695ccba",
      "media_type": "application/json",
      "size_bytes": 884,
      "redacted": true
    },
    {
      "id": "id-00000000",
      "kind": "cleanup_receipt",
      "step_key": null,
      "sha256": "8e695b37f4a7f3ba1de7323f65d299d26ac5a1c59a0b99af07df87a7a1977cb9",
      "media_type": "application/json",
      "size_bytes": 427,
      "redacted": true
    }
  ],
  "cleanup": {
    "status": "VERIFIED",
    "verified_at": "2026-01-01T00:00:22.000Z",
    "resources": [
      {
        "kind": "vm-instance",
        "id": "vm-instance:hc-00000000-89663e",
        "state": "removed"
      },
      {
        "kind": "directory",
        "id": "host-staging:hc-00000000-89663e",
        "state": "removed"
      }
    ],
    "note": null
  },
  "state_history": [
    {
      "seq": 0,
      "from_state": null,
      "to_state": "CREATED",
      "reason": null,
      "at": "2026-01-01T00:00:04.000Z"
    },
    {
      "seq": 1,
      "from_state": "CREATED",
      "to_state": "PREFLIGHT",
      "reason": null,
      "at": "2026-01-01T00:00:06.000Z"
    },
    {
      "seq": 2,
      "from_state": "PREFLIGHT",
      "to_state": "RUNNING",
      "reason": null,
      "at": "2026-01-01T00:00:09.000Z"
    },
    {
      "seq": 3,
      "from_state": "RUNNING",
      "to_state": "ABORTED",
      "reason": "RUN_ABORTED",
      "at": "2026-01-01T00:00:21.000Z"
    },
    {
      "seq": 4,
      "from_state": "ABORTED",
      "to_state": "CLEANUP_VERIFIED",
      "reason": "VERIFIED",
      "at": "2026-01-01T00:00:24.000Z"
    }
  ]
}
